Accession	Title	Series Type	Taxonomy	Sample Count	Datasets	Supplementary Types	Supplementary Links	PubMed ID	SRA Accession	Contact	Release Date
GSE16835	"Regulatory T-cell comittment is ensured by inhibition of the global gene regulator SATB1"	"Expression profiling by array"	"Homo sapiens"	10		"TXT"	"ftp://ftp.ncbi.nlm.nih.gov/geo/series/GSE16nnn/GSE16835/suppl"			"Joachim Schultze"	"May 31, 2017"
GSE16990	"FOXP3-mediated inhibition of a global gene regulator is required for maintaining Treg cell commitment"	"Expression profiling by array"	"Homo sapiens"	12		"TXT"	"ftp://ftp.ncbi.nlm.nih.gov/geo/series/GSE16nnn/GSE16990/suppl"			"Joachim Schultze"	"May 31, 2017"
GSE17946	"TNF dependent induction of inhibitory pathways in CD4+ T cells in HIV and LCMV [CD4+ T activation]"	"Expression profiling by array"	"Homo sapiens"	21		"TXT"	"ftp://ftp.ncbi.nlm.nih.gov/geo/series/GSE17nnn/GSE17946/suppl"			"Joachim Schultze"	"Mar 07, 2016"
GSE52185	"TNF dependent induction of inhibitory pathways in CD4+ T cells in HIV and LCMV"	"Expression profiling by array"	"Homo sapiens;Mus musculus"	82				26950238		"Joachim Schultze"	"Mar 07, 2016"
GSE55468	"Genome-wide analysis of gene expression variation in CD4+ T cells from patients with active rheumatoid arthritis (RA)."	"Expression profiling by array"	"Homo sapiens"	26		"TXT"	"ftp://ftp.ncbi.nlm.nih.gov/geo/series/GSE55nnn/GSE55468/suppl"	24959711		"Toni Julià"	"May 26, 2014"
GSE40878	"Expression of the placental transcriptome in fetal growth restriction in the Baboon is Dependent on Fetal Sex"	"Expression profiling by array"	"Homo sapiens;Papio hamadryas"	12		"TXT"	"ftp://ftp.ncbi.nlm.nih.gov/geo/series/GSE40nnn/GSE40878/suppl"	24047701		"Laura L Cox"	"Dec 06, 2013"
GSE27276	"Genome-wide Expression of Trabecular Meshwork in POAG"	"Expression profiling by array"	"Homo sapiens"	36		"TXT"	"ftp://ftp.ncbi.nlm.nih.gov/geo/series/GSE27nnn/GSE27276/suppl"	24003086		"Yutao Liu"	"Aug 31, 2013"
GSE29521	"Early gene expression changes in peripheral blood leukocytes with rush immunotherapy"	"Expression profiling by array"	"Homo sapiens"	13		"TXT"	"ftp://ftp.ncbi.nlm.nih.gov/geo/series/GSE29nnn/GSE29521/suppl"			"Laurie S Davis"	"Dec 30, 2011"
GSE28302	"Whole genome expression array profiling highlights differences in mucosal defense genes in Barrett's esophagus and esophageal adenocarcinoma."	"Expression profiling by array"	"Homo sapiens"	54		"TXT"	"ftp://ftp.ncbi.nlm.nih.gov/geo/series/GSE28nnn/GSE28302/suppl"	21829465		"Derek John Nancarrow"	"Aug 17, 2011"
GSE15390	"FOXP3-mediated inhibition of the global gene regulator SATB1 is required for maintaining regulatory T cell commitment"	"Expression profiling by array"	"Homo sapiens"	68		"TXT"	"ftp://ftp.ncbi.nlm.nih.gov/geo/series/GSE15nnn/GSE15390/suppl"	21841785		"Joachim Schultze"	"Aug 14, 2011"
GSE15468	"Application of blood transcriptomics to identify three novel biomarkers for monitoring anti-TGFbeta therapy"	"Expression profiling by array"	"Homo sapiens"	22		"TXT"	"ftp://ftp.ncbi.nlm.nih.gov/geo/series/GSE15nnn/GSE15468/suppl"	20084050		"Joachim Schultze"	"Jul 20, 2010"
GSE16907	"Genome-wide analysis of the effects of Power Training and Hormone Replacement Therapy on muscle properties"	"Expression profiling by array"	"Homo sapiens"	60		"TXT"	"ftp://ftp.ncbi.nlm.nih.gov/geo/series/GSE16nnn/GSE16907/suppl"			"Eija Pöllänen"	"Apr 22, 2010"
GSE21221	"Identification of differentially expressed genes in fibroblasts derived from patients with Dupuytren's Contracture"	"Expression profiling by array"	"Homo sapiens"	24		"XLS"	"ftp://ftp.ncbi.nlm.nih.gov/geo/series/GSE21nnn/GSE21221/suppl"	18433489		"Latha Satish"	"Apr 16, 2010"
GSE17241	"Genome-wide analysis of SATB1 target genes in human T helper cells"	"Expression profiling by array"	"Homo sapiens"	66		"TXT"	"ftp://ftp.ncbi.nlm.nih.gov/geo/series/GSE17nnn/GSE17241/suppl"	20522714		"Helena Ahlfors"	"Jan 07, 2010"
GSE18444	"Genome-wide transcriptional profiling of NF1-haploinsufficiency in human: Coriell kindred"	"Expression profiling by array"	"Homo sapiens"	18		"TXT"	"ftp://ftp.ncbi.nlm.nih.gov/geo/series/GSE18nnn/GSE18444/suppl"	20307317		"Alexander Pemov"	"Nov 30, 2009"
GSE18445	"Genome-wide transcriptional profiling of NF1-haploinsufficiency in human: ECACC kindred"	"Expression profiling by array"	"Homo sapiens"	6		"TXT"	"ftp://ftp.ncbi.nlm.nih.gov/geo/series/GSE18nnn/GSE18445/suppl"	20307317		"Alexander Pemov"	"Nov 30, 2009"
GSE18448	"Genome-wide transcriptional profiling of Nf1-haploinsufficiency"	"Expression profiling by array"	"Homo sapiens;Mus musculus"	36				20307317		"Alexander Pemov"	"Nov 30, 2009"
GSE18574	"Allergen-challenged CD4+ cells from patients with seasonal allergic rhinitis"	"Expression profiling by array"	"Homo sapiens"	6		"TXT"	"ftp://ftp.ncbi.nlm.nih.gov/geo/series/GSE18nnn/GSE18574/suppl"	22703998		"Mikael Benson"	"Oct 16, 2009"
GSE12051	"Microarray predictor of response to infliximab in rheumatoid arthritis (RA) patients"	"Expression profiling by array"	"Homo sapiens"	44	GDS3628	"TXT"	"ftp://ftp.ncbi.nlm.nih.gov/geo/series/GSE12nnn/GSE12051/suppl"	19847310		"Toni Julià"	"Oct 02, 2009"
GSE15316	"Differential expression of rituximab responders vs. non responders on 3 different blood cell types"	"Expression profiling by array"	"Homo sapiens"	23		"TXT"	"ftp://ftp.ncbi.nlm.nih.gov/geo/series/GSE15nnn/GSE15316/suppl"	19842941		"Toni Julià"	"Oct 02, 2009"
GSE12870	"Regulation of leukemic cell differentiation and retinoid-induced gene expression by statins"	"Expression profiling by array"	"Homo sapiens"	36		"TXT"	"ftp://ftp.ncbi.nlm.nih.gov/geo/series/GSE12nnn/GSE12870/suppl"	19240159		"Raffaele A Calogero"	"Jan 20, 2009"
GSE11061	"Colony Stimulating Factor 1 (CSF-1) responses in human monocyte derived macrophages"	"Expression profiling by array"	"Homo sapiens"	6	GDS3686	"TXT"	"ftp://ftp.ncbi.nlm.nih.gov/geo/series/GSE11nnn/GSE11061/suppl"	19004987		"Katharine Irvine"	"Nov 14, 2008"
GSE10372	"High expression of SerpinA1 and SerpinA3 in HLA-positive cervical cell carcinomas"	"Expression profiling by array"	"Homo sapiens"	36		"TXT"	"ftp://ftp.ncbi.nlm.nih.gov/geo/series/GSE10nnn/GSE10372/suppl"	18438953		"Jan Oosting"	"May 23, 2008"
GSE7471	"Gene Expression Profiles in Intracranial Arteries and Abdominal Aortae"	"Expression profiling by array"	"Homo sapiens"	12		"TXT"	"ftp://ftp.ncbi.nlm.nih.gov/geo/series/GSE7nnn/GSE7471/suppl"			"Gerard Tromp"	"Apr 04, 2008"
GSE10905	"Profiling BRCA1, BRCA2 and non-BRCA1/2 LCLs post-Irradiation"	"Expression profiling by array"	"Homo sapiens"	79		"TXT"	"ftp://ftp.ncbi.nlm.nih.gov/geo/series/GSE10nnn/GSE10905/suppl"	18497862		"Nic Waddell"	"Mar 21, 2008"
GSE8632	"RNA binding activity of the recessive parkinsonism protein DJ-1"	"Expression profiling by array"	"Homo sapiens;Mus musculus"	4		"TXT"	"ftp://ftp.ncbi.nlm.nih.gov/geo/series/GSE8nnn/GSE8632/suppl"	18626009		"J Raphael Gibbs"	"Mar 14, 2008"
GSE6818	"Cell response to Au nanoparticles"	"Expression profiling by array"	"Homo sapiens"	39		"TXT"	"ftp://ftp.ncbi.nlm.nih.gov/geo/series/GSE6nnn/GSE6818/suppl"			"Lianghao Ding"	"Jan 20, 2008"
GSE6551	"Expression data from intracranial arteries and intracranial aneurysms"	"Expression profiling by array"	"Homo sapiens"	10		"CEL;TXT"	"ftp://ftp.ncbi.nlm.nih.gov/geo/series/GSE6nnn/GSE6551/suppl"	17878320		"Gerard Tromp"	"Nov 20, 2007"
GSE8686	"Gene expression profiling in three primary human cell lines treated with atorvastatin or an inhibitor of Rho kinase"	"Expression profiling by array"	"Homo sapiens"	36	GDS2987	"TXT"	"ftp://ftp.ncbi.nlm.nih.gov/geo/series/GSE8nnn/GSE8686/suppl"	18832915		"Marjan Boerma"	"Aug 23, 2007"
GSE7084	"Expression data from the abdominal aorta and abdominal aortic aneurysm"	"Expression profiling by array"	"Homo sapiens"	19	GDS2838	"TXT"	"ftp://ftp.ncbi.nlm.nih.gov/geo/series/GSE7nnn/GSE7084/suppl"	17634102;21493888		"Gerard Tromp"	"Jul 26, 2007"
GSE7865	"Gene expression in undifferentiated human ES cells - Illumina"	"Expression profiling by array"	"Homo sapiens"	3		"TXT"	"ftp://ftp.ncbi.nlm.nih.gov/geo/series/GSE7nnn/GSE7865/suppl"	17597760		"Paul Tesar"	"Jun 27, 2007"
GSE7902	"Novel cell lines from mouse epiblast share defining features with human embryonic stem cells"	"Expression profiling by array"	"Homo sapiens;Mus musculus"	12		"TXT"	"ftp://ftp.ncbi.nlm.nih.gov/geo/series/GSE7nnn/GSE7902/suppl"	17597760		"Paul Tesar"	"Jun 27, 2007"
GSE6645	"Comparison of gene expression in human embyronic  stem cells grown in MEF-CM or defined media conditions"	"Expression profiling by array"	"Homo sapiens"	4		"TXT"	"ftp://ftp.ncbi.nlm.nih.gov/geo/series/GSE6nnn/GSE6645/suppl"	17761519		"Tom Schulz"	"Jun 24, 2007"
GSE7019	"Total RNA from EPC derived microvescicles"	"Expression profiling by array"	"Homo sapiens"	6		"TXT"	"ftp://ftp.ncbi.nlm.nih.gov/geo/series/GSE7nnn/GSE7019/suppl"	17536014		"Raffaele A Calogero"	"Jun 06, 2007"
GSE5422	"Knock-down of three core transcription factors in hEC cells"	"Expression profiling by array"	"Homo sapiens"	4		"TXT"	"ftp://ftp.ncbi.nlm.nih.gov/geo/series/GSE5nnn/GSE5422/suppl"	17506876		"Boris Greber"	"Jun 01, 2007"
GSE5423	"H9 hES cells vs. universal RNAs"	"Expression profiling by array"	"Homo sapiens"	2		"TXT"	"ftp://ftp.ncbi.nlm.nih.gov/geo/series/GSE5nnn/GSE5423/suppl"	17506876		"Boris Greber"	"Jun 01, 2007"
GSE7833	"Regulation of mRNA transcript expression by hypoxia in human peripheral blood lymphocytes"	"Expression profiling by array"	"Homo sapiens"	6	GDS2951	"TXT"	"ftp://ftp.ncbi.nlm.nih.gov/geo/series/GSE7nnn/GSE7833/suppl"	19008490		"Jerome Tremblay Brooks"	"May 18, 2007"
GSE7497	"Influence of TGFbeta on human resting CD4+ T cells"	"Expression profiling by array"	"Homo sapiens"	44		"CEL;TXT"	"ftp://ftp.ncbi.nlm.nih.gov/geo/series/GSE7nnn/GSE7497/suppl"	17513742		"Joachim Schultze"	"May 01, 2007"
GSE6967	"Spermatozoal RNA Profiles (Human-6 BeadChip)"	"Expression profiling by array"	"Homo sapiens"	13	GDS2696	"TXT"	"ftp://ftp.ncbi.nlm.nih.gov/geo/series/GSE6nnn/GSE6967/suppl"	17327269		"Stephen A Krawetz"	"Apr 27, 2007"
GSE6969	"Spermatozoal RNA Profiles from Normally Fertile and Heterogeneously Teratozoospermic Subjects"	"Expression profiling by array"	"Homo sapiens"	44		"CEL;TXT"	"ftp://ftp.ncbi.nlm.nih.gov/geo/series/GSE6nnn/GSE6969/suppl"	17327269		"Stephen A Krawetz"	"Apr 27, 2007"
GSE6269	"Gene expression patterns in blood leukocytes discriminate patients with acute infections"	"Expression profiling by array"	"Homo sapiens"	143		"CEL;TXT"	"ftp://ftp.ncbi.nlm.nih.gov/geo/series/GSE6nnn/GSE6269/suppl"	17105821		"Damien Chaussabel"	"Mar 16, 2007"
GSE6536	"Whole-genome gene expression variation in 210 unrelated HapMap individuals"	"Expression profiling by array"	"Homo sapiens"	480		"TXT"	"ftp://ftp.ncbi.nlm.nih.gov/geo/series/GSE6nnn/GSE6536/suppl"	17289997;17873874		"Emmanouil T Dermitzakis"	"Feb 09, 2007"
GSE6627	"Identification of genes directly regulated by the oncogene ZNF217 using ChIP-chip assays (Expression Data)"	"Expression profiling by array"	"Homo sapiens"	6				17259635		"Victor X Jin"	"Jan 25, 2007"
GSE6634	"Genes Directly Regulated by the Oncogene ZNF217 Using ChIP-chip Assays on ENCODE and Promoter Arrays and Expression Data"	"Expression profiling by array;Genome binding/occupancy profiling by genome tiling array"	"Homo sapiens"	43		"TXT"	"ftp://ftp.ncbi.nlm.nih.gov/geo/series/GSE6nnn/GSE6634/suppl"	17259635		"Victor X Jin"	"Jan 25, 2007"
GSE6374	"Lymphoblastoid cell lines of families with Mitochondrial Myopathy and Sideroblastic Anemia"	"Expression profiling by array"	"Homo sapiens"	15		"CSV"	"ftp://ftp.ncbi.nlm.nih.gov/geo/series/GSE6nnn/GSE6374/suppl"	17374500		"Yelena Bykhovskaya"	"Nov 29, 2006"
GSE5350	"MicroArray Quality Control (MAQC) Project"	"Expression profiling by array;Expression profiling by RT-PCR"	"Homo sapiens;Rattus norvegicus"	943		"CEL;CSV;GPR;LSR;PDF;TXT;ZIP"	"ftp://ftp.ncbi.nlm.nih.gov/geo/series/GSE5nnn/GSE5350/suppl"	16964229;20946593;25150837;25633159		"Leming Shi"	"Sep 08, 2006"
GSE5095	"MT1-MMP induces malignant transformation in Mammary cells"	"Expression profiling by array"	"Homo sapiens"	6				17079467		"Roy M Williams"	"Jun 21, 2006"
GSE3188	"Hypoxic regulation of gene expression is dominated by the HIF system and can be mimicked by DMOG"	"Expression profiling by array"	"Homo sapiens"	39	GDS2758;GDS2759;GDS2760;GDS2761			16565084		"Ioannis Ragoussis"	"Dec 01, 2005"
